#,Name,Description,Icon,,MaxStacks,ClassJobCategory,StatusCategory,HitEffect,VFX,LockMovement,,LockActions,LockControl,Transfiguration,IsGaze,CanDispel,InflictedByActor,IsPermanent,PartyListPriority,CanIncreaseRewards,,,ParamModifier,ParamEffect,CanStatusOff,Log,IsFcBuff,,Invisibility,TargetType,Flags,,
944,"Épée de l'Azur","Les dégâts infligés sont augmentés. Le même effet est conféré aux alliés alentour.",15668,0,0,1,1,16,0,False,False,False,False,False,False,False,True,True,200,0,False,False,0,0,False,0,False,0,False,0,0,0,False
945,"Bouclier de l'Azur","Les dégâts reçus sont réduits. Le même effet est conféré aux alliés alentour.",15667,0,0,1,1,16,0,False,False,False,False,False,False,False,True,True,200,0,False,False,0,0,False,0,False,0,False,0,0,0,False
946,"Forme d'araignée","Le ghrah a pris la forme d'une araignée.",15679,69,0,1,1,16,0,False,False,False,False,False,False,False,True,True,0,0,False,False,0,0,False,0,False,0,False,0,0,0,False
947,"Forme d'oiseau","Le ghrah a pris la forme d'un oiseau.",15678,69,0,1,1,16,0,False,False,False,False,False,False,False,True,True,0,0,False,False,0,0,False,0,False,0,False,0,0,0,False
948,"Riposte de foudre","Des dégâts de foudre sont infligés chaque fois qu'un coup est reçu.",15684,0,0,1,1,16,0,False,False,False,False,False,False,False,True,False,1,0,False,False,0,0,False,0,False,0,False,0,0,0,False
949,"Riposte de feu","Des dégâts de feu sont infligés chaque fois qu'un coup est reçu.",15685,0,0,1,1,16,0,False,False,False,False,False,False,False,True,False,1,0,False,False,0,0,False,0,False,0,False,0,0,0,False
950,"Riposte de glace","Des dégâts de glace sont infligés chaque fois qu'un coup est reçu.",15686,0,0,1,1,16,0,False,False,False,False,False,False,False,True,False,1,0,False,False,0,0,False,0,False,0,False,0,0,0,False
951,"Riposte de vent","Des dégâts de vent sont infligés chaque fois qu'un coup est reçu.",15687,0,0,1,1,16,0,False,False,False,False,False,False,False,True,False,1,0,False,False,0,0,False,0,False,0,False,0,0,0,False
952,"Riposte de terre","Des dégâts de terre sont infligés chaque fois qu'un coup est reçu.",15688,0,0,1,1,16,0,False,False,False,False,False,False,False,True,False,1,0,False,False,0,0,False,0,False,0,False,0,0,0,False
953,"Riposte d'eau","Des dégâts d'eau sont infligés chaque fois qu'un coup est reçu.",15689,0,0,1,1,16,0,False,False,False,False,False,False,False,True,False,1,0,False,False,0,0,False,0,False,0,False,0,0,0,False
954,"Riposte neutre","Des dégâts neutres sont infligés chaque fois qu'un coup est reçu.",15690,0,0,1,1,16,0,False,False,False,False,False,False,False,True,False,1,0,False,False,0,0,False,0,False,0,False,0,0,0,False
955,"Bonus de magie curative","La puissance de la magie curative est augmentée.",15058,0,0,1,1,16,0,False,False,False,False,False,False,False,False,False,0,0,False,False,30,0,False,0,False,0,False,0,0,0,False
956,"Inconscient collectif","Récupère des PV périodiquement.",13225,0,0,99,1,16,0,False,False,False,False,False,False,False,False,False,5,0,False,False,10,0,False,0,False,0,False,0,0,0,False
957,"Enzyme digestive","Une enzyme recouvre le corps, augmentant l'effet Dévoration.",18421,0,8,1,2,17,0,False,False,False,False,False,False,False,True,False,0,0,False,False,0,0,False,0,False,0,False,0,0,0,False
958,"Marquage","Fait l'objet du marquage d'un prédateur, qui sera transféré à un autre personnage s'il passe à proximité.",15026,0,0,1,2,17,0,False,False,False,False,False,False,False,True,True,200,0,False,False,0,0,False,0,False,0,False,0,0,0,False
959,"Forme d'humain","Le ghrah a pris la forme d'un être humain.",15669,69,0,1,1,16,0,False,False,False,False,False,False,False,True,True,0,0,False,False,0,0,False,0,False,0,False,0,0,0,False
960,"Chaleur","Des dégâts de feu sont subis après chaque action.",15647,0,0,1,2,17,19,False,False,False,False,False,False,False,False,False,99,0,False,False,100,0,False,0,False,0,False,0,23,0,False
961,"Étreinte mortelle","Les mouvements sont bloqués, et des dégâts périodiques sont subis.",15564,0,0,1,2,17,0,True,False,True,False,False,False,False,False,False,0,0,False,False,500,0,False,0,False,5,False,0,0,0,False
962,"Bonus d'attaque","L'attaque est augmentée.",15050,0,0,1,1,16,0,False,False,False,False,False,False,False,False,False,0,0,False,True,0,8,False,0,False,0,False,0,0,0,False
963,"Malus d'attaque","L'attaque est réduite.",15051,0,0,1,2,17,0,False,False,False,False,False,False,False,False,False,0,0,False,True,0,8,False,0,False,0,False,0,0,0,False
964,"Bonus de défense","La défense est augmentée.",15052,0,0,1,1,16,0,False,False,False,False,False,False,False,False,False,0,0,False,True,0,8,False,0,False,0,False,0,0,0,False
965,"Malus de défense","La défense est réduite.",15053,0,0,1,2,17,0,False,False,False,False,False,False,False,False,False,0,0,False,True,0,8,False,0,False,0,False,0,0,0,False
966,"Bonus de vitesse","La vitesse est augmentée.",15062,0,0,1,1,16,0,False,False,False,False,False,False,False,False,False,0,0,False,True,0,8,False,0,False,0,False,0,0,0,False
967,"Malus de vitesse","La vitesse est réduite.",15063,0,0,1,2,17,0,False,False,False,False,False,False,False,False,False,0,0,False,True,0,8,False,0,False,0,False,0,0,0,False
968,"Destruction arcanique","Les dégâts infligés aux pierres arcaniques sont augmentés.",16206,0,0,1,1,16,0,False,False,False,False,False,False,False,False,False,0,0,False,False,0,8,False,0,False,0,False,0,0,0,False
969,"Invulnérable","Insensible à toutes les attaques.",15024,0,0,1,1,16,0,False,False,False,False,False,False,False,False,False,0,0,False,False,0,8,False,0,False,0,False,0,0,0,False
970,"Immunité aux créatures","Insensible aux attaques provenant de mascottes de type “Créature”.",16601,0,0,1,1,16,0,False,False,False,False,False,False,False,False,False,0,0,False,False,0,8,False,0,False,0,False,0,0,0,False
971,"Immunité aux monstres","Insensible aux attaques provenant de mascottes de type “Monstre”.",16602,0,0,1,1,16,0,False,False,False,False,False,False,False,False,False,0,0,False,False,0,8,False,0,False,0,False,0,0,0,False
972,"Immunité aux poupées","Insensible aux attaques provenant de mascottes de type “Poupée”.",16603,0,0,1,1,16,0,False,False,False,False,False,False,False,False,False,0,0,False,False,0,8,False,0,False,0,False,0,0,0,False
973,"Immunité aux mécanismes","Insensible aux attaques provenant de mascottes de type “Mécanisme”.",16604,0,0,1,1,16,0,False,False,False,False,False,False,False,False,False,0,0,False,False,0,8,False,0,False,0,False,0,0,0,False
974,"Allergie aux créatures","Les dégâts des attaques provenant de mascottes de type “Créature” sont augmentés.",16605,0,0,1,2,17,0,False,False,False,False,False,False,False,False,False,0,0,False,False,0,8,False,0,False,0,False,0,0,0,False
975,"Allergie aux monstres","Les dégâts des attaques provenant de mascottes de type “Monstre” sont augmentés.",16606,0,0,1,2,17,0,False,False,False,False,False,False,False,False,False,0,0,False,False,0,8,False,0,False,0,False,0,0,0,False
976,"Allergie aux poupées","Les dégâts des attaques provenant de mascottes de type “Poupée” sont augmentés.",16607,0,0,1,2,17,0,False,False,False,False,False,False,False,False,False,0,0,False,False,0,8,False,0,False,0,False,0,0,0,False
977,"Allergie aux mécanismes","Les dégâts des attaques provenant de mascottes de type “Mécanisme” sont augmentés.",15607,0,0,1,2,17,0,False,False,False,False,False,False,False,False,False,0,0,False,False,0,0,False,0,False,0,False,0,0,0,False
978,"Bonus d'attaque et de défense","L'attaque et la défense sont augmentées.",15050,0,0,1,1,16,0,False,False,False,False,False,False,False,False,False,0,0,False,True,0,8,False,0,False,0,False,0,0,0,False
979,"Dégâts périodiques","Des dégâts périodiques sont subis.",15007,0,0,1,2,17,0,False,False,False,False,False,False,False,False,False,0,0,False,True,0,8,False,0,False,0,False,0,0,0,False
980,"Aire d'effet","Les attaques automatiques ont une aire d'effet.",15641,0,0,1,1,16,0,False,False,False,False,False,False,False,False,False,0,0,False,False,0,8,False,0,False,0,False,0,0,0,False
981,"Invulnérable","Insensible à toutes les attaques.",15024,0,0,1,1,16,0,False,False,False,False,False,False,False,True,True,0,0,False,False,0,0,False,0,False,0,False,0,0,0,False
982,"Immunité aux créatures","Insensible aux attaques provenant de mascottes de type “Créature”.",15024,0,0,1,1,16,0,False,False,False,False,False,False,False,True,True,0,0,False,False,0,0,False,0,False,0,False,0,0,0,False
983,"Immunité aux monstres","Insensible aux attaques provenant de mascottes de type “Monstre”.",15024,0,0,1,1,16,0,False,False,False,False,False,False,False,True,True,0,0,False,False,0,0,False,0,False,0,False,0,0,0,False
984,"Immunité aux poupées","Insensible aux attaques provenant de mascottes de type “Poupée”.",15024,0,0,1,1,16,0,False,False,False,False,False,False,False,True,True,0,0,False,False,0,0,False,0,False,0,False,0,0,0,False
985,"Immunité aux mécanismes","Insensible aux attaques provenant de mascottes de type “Mécanisme”.",15024,0,0,1,1,16,0,False,False,False,False,False,False,False,True,True,0,0,False,False,0,0,False,0,False,0,False,0,0,0,False
986,"Immobilité","Tout déplacement est impossible.",15609,0,0,1,2,17,0,False,False,False,False,False,False,False,False,False,0,0,False,False,0,8,False,0,False,0,False,0,0,0,False
987,"Piégeage","La technique permet de mettre en place des pièges.",16609,0,0,1,1,16,0,False,False,False,False,False,False,False,True,True,0,0,False,False,0,8,False,0,False,0,False,0,0,0,False
988,"Paralysie","Toute action est impossible.",15006,0,0,1,2,17,0,False,False,False,False,False,False,False,False,False,0,0,False,False,0,8,False,0,False,0,False,0,0,0,False
989,"Recouvrement","Récupère des PV périodiquement.",17521,0,16,1,1,16,0,False,False,False,False,False,False,False,False,False,200,0,False,False,1000,0,False,0,False,0,False,0,0,0,False
990,"Attache","Toute action est impossible.",15545,0,0,1,2,17,0,True,False,True,True,False,False,False,True,True,100,0,False,False,0,0,False,0,False,0,False,0,0,0,False
991,"Séduction","Toute volonté est perdue, et les mouvements deviennent erratiques.",15552,0,0,1,2,17,17,False,False,True,True,False,True,False,False,False,100,0,False,False,0,18,False,0,False,0,False,0,0,0,False
992,"Stimulant offensif","Les dégâts infligés sont augmentés par un stimulant.",15719,0,0,1,1,0,0,False,False,False,False,False,False,False,False,False,99,0,False,False,10,0,True,0,False,0,False,0,0,0,False
993,"Stimulant défensif","Les dégâts subis sont réduits par un stimulant.",15720,0,0,1,1,0,0,False,False,False,False,False,False,False,False,False,98,0,False,False,-20,0,True,0,False,0,False,0,0,0,False
994,"Phase de carnage","Le combat est entré dans une phase de carnage, et les dégâts subis sont augmentés. L'effet est d'autant plus fort qu'il est cumulé.",18621,0,5,1,2,17,0,False,False,False,False,False,False,False,True,True,1,0,False,False,10,0,True,0,False,0,False,0,0,0,False
995,"Traumatisme","Suite à un coup violent, les dégâts infligés sont réduits. L'effet provoque une commotion cérébrale s'il est cumulé.",18521,0,4,1,2,17,0,False,False,False,False,False,False,False,False,False,200,0,False,False,-10,0,False,0,False,0,False,0,0,0,False
996,"Commotion cérébrale","Impossible d'agir du fait d'une commotion cérébrale. Les dégâts subis sont augmentés.",15712,0,0,1,2,17,0,True,False,True,True,False,False,False,False,False,100,0,False,False,100,11,False,0,False,0,False,0,0,0,False
997,"Commotion cérébrale","Impossible d'agir du fait d'une commotion cérébrale. Les dégâts subis sont augmentés.",15712,0,0,1,2,17,0,True,False,True,True,False,False,True,False,False,100,0,False,False,100,11,False,0,False,0,False,0,0,0,False
998,"Gobsérum de force","La transformation en sasquatch empêche toute action autre que Torgnole.",15713,69,0,1,1,16,0,False,False,False,False,True,False,False,False,False,100,0,False,False,0,2,True,0,False,0,False,0,0,0,False
999,"Gobsérum de vitesse","La transformation en vautour empêche toute action autre qu'Aile tranchante.",15714,69,0,1,1,16,0,False,False,False,False,True,False,False,False,False,100,0,False,False,0,2,True,0,False,0,False,0,0,0,False
1000,"Gobsérum de furtivité","Invisible à la plupart des ennemis.",15715,69,0,1,1,16,0,False,False,False,False,False,False,False,False,False,100,0,False,False,0,0,False,0,False,0,True,0,0,0,False
1001,"Dépendance","La consommation excessive de sérum a créé une dépendance. Elle provoquera un effet secondaire à la fin de l'effet ou si elle est cumulée.",18541,0,12,1,2,17,0,False,False,False,False,False,False,False,False,False,100,0,False,False,0,0,False,0,False,0,False,0,0,0,False
1002,"Effet secondaire","L'organisme subit l'effet secondaire du gobsérum.",15717,69,0,1,2,4,6,False,False,False,False,False,False,False,False,False,100,0,False,False,1000,1,False,0,False,5,False,0,0,0,False
1003,"Scientifique super musclé","Le gobsérum a développé la musculature à l'extrême. Les dégâts infligés sont augmentés et ceux subis sont réduits.",15718,69,0,1,1,16,0,False,False,False,False,True,False,False,True,True,100,0,False,False,30,2,False,0,False,0,False,0,0,0,False
1004,"Anticoagulant","Une substance anticoagulante agit sur l'organisme. Des dégâts périodiques sont subis. L'effet rend inconscient s'il est accumulé.",18561,0,8,1,2,17,0,False,False,False,False,False,False,False,True,True,200,0,False,False,300,10,False,0,False,5,False,0,23,0,False
1005,"Champ de force physique","Les dégâts physiques reçus sont grandement réduits, mais ceux magiques sont grandement augmentés.",15709,0,0,1,2,17,0,False,False,False,False,False,False,False,False,False,200,0,False,False,-99,0,False,0,False,0,False,0,0,0,False
1006,"Champ de force magique","Les dégâts magiques reçus sont grandement réduits, mais ceux physiques sont grandement augmentés.",15710,0,0,1,2,17,0,False,False,False,False,False,False,False,False,False,200,0,False,False,-99,0,False,0,False,0,False,0,0,0,False
1007,"Invisible","Invisible à la plupart des ennemis.",15642,0,0,1,1,16,0,False,False,False,False,False,False,False,False,False,100,0,False,False,0,0,False,0,False,0,True,1,0,0,False
1008,"Gobsérum de soin","Les facultés de récupération sont augmentées. L'effet anticoagulant est dissipé et des PV sont récupérés périodiquement.",15716,69,0,1,1,16,0,False,False,False,False,False,False,False,False,False,100,0,False,False,300,0,False,0,False,0,False,0,0,0,False
1009,"Batrachomorphose","Le corps est en train de changer de forme. Transforme en crapaud si l'effet est cumulé.",18641,0,8,1,2,17,0,False,False,False,False,False,False,False,True,False,0,0,False,False,0,0,False,0,False,0,False,0,0,0,False
1010,"Attache","Toute action est impossible.",15545,0,0,1,2,17,0,False,False,True,True,False,False,False,True,True,100,0,False,False,0,9,False,0,False,0,False,3,0,0,False
1011,"Poison concentré","Des dégâts périodiques sont subis et l'effet des sorts de restauration des PV est réduit.",18581,0,8,1,2,17,0,False,False,False,False,False,False,False,True,True,50,0,False,False,300,0,False,0,False,5,False,0,0,0,False
1012,"Excitation","L'état d'activité est décuplé du fait d'une grande excitation.",18601,0,8,1,1,16,0,False,False,False,False,False,False,False,False,False,200,0,False,False,80,0,False,0,False,0,False,0,0,0,False
1013,"Inversion","L'effet de la magie blanche est inversé, lui conférant un pouvoir destructeur.",15691,0,0,1,1,16,0,False,False,False,False,False,False,False,True,True,200,0,False,False,0,0,False,0,False,0,False,0,0,0,False
1014,"Recouvrement","Des PV sont récupérés périodiquement.",12626,0,0,1,1,16,0,False,False,False,False,False,False,False,False,False,5,0,False,False,10,0,False,0,False,0,False,0,0,0,False
1015,"Vie","En état de survie temporaire. L'utilisation d'un degré permet d'annuler l'état inconscient une fois.",18661,0,2,1,1,16,0,False,False,False,False,False,False,False,True,True,0,0,False,False,0,0,False,0,False,0,False,0,0,0,False
1016,"Malus de dégâts","Les dégâts infligés sont réduits.",18441,39,16,1,2,17,0,False,False,False,False,False,False,False,False,False,50,0,False,False,-10,0,False,0,False,0,False,0,0,0,False
1017,"Bonus de dégâts physiques","Les dégâts physiques infligés sont augmentés.",15050,35,0,1,1,16,0,False,False,False,False,False,False,False,True,True,1,0,False,False,10,0,False,0,False,0,False,0,0,0,False
1018,"Bonus de dégâts physiques","Les dégâts physiques infligés sont augmentés.",18461,35,16,1,1,16,0,False,False,False,False,False,False,False,True,True,1,0,False,False,10,0,False,0,False,0,False,0,0,0,False
1019,"Bonus de dégâts magiques","Les dégâts magiques infligés sont augmentés.",18481,37,16,1,1,16,0,False,False,False,False,False,False,False,True,True,1,0,False,False,10,0,False,0,False,0,False,0,0,0,False
1020,"Calcul bionumérique","Les capacités sont calculées sur la base du nombre d'alliés alentour.",15693,0,0,1,1,16,0,False,False,False,False,False,False,False,True,True,200,0,False,False,0,0,False,0,False,0,False,0,0,0,False
1021,"Calcul de dénivelé 1","Se trouver en position basse fait subir une attaque.",15694,0,0,1,2,17,0,False,False,False,False,False,False,False,True,True,199,0,False,False,0,0,False,0,False,0,False,0,0,0,False
1022,"Calcul de dénivelé 2","Se trouver en position haute fait subir une attaque.",15695,0,0,1,2,17,0,False,False,False,False,False,False,False,True,True,199,0,False,False,0,0,False,0,False,0,False,0,0,0,False
1023,"Compression aqueuse","De l'éther d'élément eau enveloppe le corps. Une attaque aqueuse est lancée à la fin de l'effet.",15696,0,0,1,2,17,0,False,False,False,False,False,False,False,False,False,200,0,False,False,0,0,False,0,False,0,False,0,0,0,False
1024,"Compression électrique","De l'éther d'élément foudre enveloppe le corps. Une attaque électrique est lancée à la fin de l'effet.",15697,0,0,1,2,17,0,False,False,False,False,False,False,False,False,False,200,0,False,False,0,0,False,0,False,0,False,0,0,0,False
1025,"Résistance à l'eau réduite+","La résistance à l'élément eau est considérablement réduite.",15698,0,0,1,2,17,0,False,False,False,False,False,False,False,False,False,200,0,False,False,-12,0,False,0,False,0,False,0,0,0,False
1026,"Résistance à la foudre réduite+","La résistance à l'élément foudre est considérablement réduite.",15597,0,0,1,2,17,0,False,False,False,False,False,False,False,False,False,200,0,False,False,-12,0,False,0,False,0,False,0,0,0,False
1027,"Punition ultime","L'ordre a été donné de recevoir une punition. Toute désobéissance donnera lieu à un châtiment divin.",18501,0,4,1,2,17,0,False,False,False,False,False,False,False,False,False,199,0,False,False,0,0,False,0,False,0,False,0,0,0,False
1028,"Attaque directe","En mesure d'attaquer directement.",15652,0,0,1,1,16,0,False,False,False,False,False,False,False,True,True,40,0,False,False,0,0,True,0,False,0,False,0,0,0,False
1029,"Peine provisoire α ultime","La culpabilité pour crime α a été reconnue.",15699,0,0,1,2,17,0,False,False,False,False,False,False,False,False,False,197,0,False,False,20,0,False,0,False,5,False,0,0,0,False
1030,"Peine provisoire β ultime","La culpabilité pour crime β a été reconnue.",15700,0,0,1,2,17,0,False,False,False,False,False,False,False,False,False,197,0,False,False,20,0,False,0,False,5,False,0,0,0,False
1031,"Injonction<Indent/>: plus hauts PV","L'ordre a été donné d'avoir les PV les plus hauts. Toute désobéissance donnera lieu à un châtiment divin.",15701,0,0,1,2,17,0,False,False,False,False,False,False,False,True,True,200,0,False,False,0,0,False,0,False,0,False,0,0,0,False
1032,"Injonction<Indent/>: plus bas PV","L'ordre a été donné d'avoir les PV les plus bas. Toute désobéissance donnera lieu à un châtiment divin.",15702,0,0,1,2,17,0,False,False,False,False,False,False,False,True,True,200,0,False,False,0,0,False,0,False,0,False,0,0,0,False
1033,"Injonction<Indent/>: 1 altération","L'ordre a été donné de subir une altération d'état. Toute désobéissance donnera lieu à un châtiment divin.",15703,0,0,1,2,17,0,False,False,False,False,False,False,False,True,True,200,0,False,False,0,0,False,0,False,0,False,0,0,0,False
1034,"Injonction<Indent/>: 2 altérations","L'ordre a été donné de subir deux altérations d'état. Toute désobéissance donnera lieu à un châtiment divin.",15704,0,0,1,2,17,0,False,False,False,False,False,False,False,True,True,200,0,False,False,0,0,False,0,False,0,False,0,0,0,False
1035,"Injonction<Indent/>: 3 altérations","L'ordre a été donné de subir trois altérations d'état. Toute désobéissance donnera lieu à un châtiment divin.",15705,0,0,1,2,17,0,False,False,False,False,False,False,False,True,True,200,0,False,False,0,0,False,0,False,0,False,0,0,0,False
1036,"Injonction<Indent/>: peine provisoire α","L'ordre a été donné de subir la peine provisoire α. Toute désobéissance donnera lieu à un châtiment divin.",15706,0,0,1,2,17,0,False,False,False,False,False,False,False,True,True,200,0,False,False,0,0,False,0,False,0,False,0,0,0,False
1037,"Injonction<Indent/>: peine provisoire β","L'ordre a été donné de subir la peine provisoire β. Toute désobéissance donnera lieu à un châtiment divin.",15707,0,0,1,2,17,0,False,False,False,False,False,False,False,True,True,200,0,False,False,0,0,False,0,False,0,False,0,0,0,False
1038,"Éventement funéraire","Cyclone justicier a favorisé l'effet du vent. Les dégâts subis à cause de Cyclone justicier sont augmentés.",15708,0,0,1,2,17,0,False,False,False,False,False,False,False,False,False,198,0,False,False,0,0,False,0,False,0,False,0,0,0,False
1039,"Conviction de la Lumière","La conviction propre au pouvoir de la Lumière permet de dépasser ses limites.",15711,0,0,1,1,16,0,False,False,False,False,False,False,False,True,True,200,0,False,False,10,0,False,0,False,0,False,0,0,0,False
1040,"Conviction de la Lumière","La conviction propre au pouvoir de la Lumière permet de dépasser ses limites.",15711,0,0,1,1,16,0,False,False,False,False,False,False,False,True,True,200,0,False,False,10,0,False,0,False,0,False,0,0,0,False
1041,"Conviction de la Lumière","La conviction propre au pouvoir de la Lumière permet de dépasser ses limites.",15711,0,0,1,1,16,0,False,False,False,False,False,False,False,True,True,200,0,False,False,10,0,False,0,False,0,False,0,0,0,False
1042,"Attaque directe","En mesure d'attaquer directement.",15652,0,0,1,1,16,0,False,False,False,False,False,False,False,True,True,40,0,False,False,0,0,True,0,False,0,False,0,0,0,False
1043,"Attaque directe","En mesure d'attaquer directement.",15652,0,0,1,1,16,0,False,False,False,False,False,False,False,True,True,40,0,False,False,0,0,True,0,False,0,False,0,0,0,False
1044,"Lévitation magnétique","Un champ de force magnétique permet de flotter dans l'air.",15037,0,0,1,1,16,4,False,False,False,False,False,False,False,True,True,1,0,False,False,0,12,True,0,False,0,False,0,0,0,False
1045,"Zombification progressive","L'être se transforme petit à petit en zombi.",15728,64,2,1,2,17,0,False,False,False,False,False,False,False,False,False,200,0,False,False,0,0,False,0,False,0,False,0,0,0,False
1046,"Poison concentré","Des dégâts périodiques sont subis et l'effet des sorts de restauration des PV est réduit.",18581,0,8,1,2,17,0,False,False,False,False,False,False,False,False,False,50,0,False,False,300,0,False,0,False,5,False,0,0,0,False
1047,"Confusion","La folie fait attaquer les alliés à la place des ennemis.",15603,64,0,1,2,17,0,False,False,False,True,False,True,True,False,False,100,0,False,False,0,0,False,0,False,0,False,0,0,0,False
1048,"Attaque directe","En mesure d'attaquer directement.",15652,0,0,1,1,16,0,False,False,False,False,False,False,False,True,True,40,0,False,False,0,0,True,0,False,0,False,0,0,0,False
1049,"Chaleur","Des dégâts de feu sont subis après chaque action.",15647,0,0,1,2,17,19,False,False,False,False,False,False,False,True,True,99,0,False,False,100,0,False,0,False,0,False,0,23,0,False
1050,"Bonus de points d'expérience","Mentors et novices/rappelés reçoivent un bonus aux points d'expérience obtenus en étant dans une même équipe.",16222,0,0,1,1,16,0,False,False,False,False,False,False,False,True,True,100,0,False,False,50,0,True,0,False,0,False,0,0,0,False
1051,"Marquage","Fait l'objet du marquage d'un prédateur.",15026,0,0,1,2,17,0,False,False,False,False,False,False,False,True,True,200,0,False,False,0,0,False,0,False,0,False,0,0,0,False
1052,"Résistance au vent réduite+","La résistance à l'élément vent est considérablement réduite.",15721,0,0,1,2,17,0,False,False,False,False,False,False,False,False,False,200,0,False,False,-12,0,False,0,False,0,False,0,0,0,False
1053,"Résistance à la terre réduite+","La résistance à l'élément terre est considérablement réduite.",15722,0,0,1,2,17,0,False,False,False,False,False,False,False,False,False,200,0,False,False,-12,0,False,0,False,0,False,0,0,0,False
1054,"Vulnérabilité augmentée","Les dégâts reçus sont augmentés.",15020,40,0,1,2,17,0,False,False,False,False,False,False,False,True,True,50,0,False,False,10,0,False,0,False,0,False,0,0,0,False
1055,"Attache","Toute action est impossible.",15545,0,0,1,2,17,0,True,False,True,True,False,False,False,True,True,10,0,False,False,0,0,False,0,False,0,False,3,9,0,False
1056,"Mime","Un effet similaire à celui de l'aptitude ou de l'objet utilisé par l'advervaire placé devant sera obtenu le cas échéant.",16583,0,0,1,1,0,0,False,False,False,False,False,False,False,False,False,0,0,False,False,0,0,True,0,False,0,False,0,0,0,False
