#,Name,Description,Icon,,MaxStacks,ClassJobCategory,StatusCategory,HitEffect,VFX,LockMovement,,LockActions,LockControl,Transfiguration,IsGaze,CanDispel,InflictedByActor,IsPermanent,PartyListPriority,CanIncreaseRewards,,,ParamModifier,ParamEffect,CanStatusOff,Log,IsFcBuff,,Invisibility,TargetType,Flags,,
2860,"Repli préparé","Repli peut être lancé.",12933,0,0,180,1,0,0,False,False,False,False,False,False,False,False,False,0,2,False,False,0,0,True,0,False,0,False,0,0,0,False
2861,"Blason protecteur","Insensible à un certain montant de dégâts et les dégâts infligés sont augmentés.",12934,0,0,180,1,16,0,False,False,False,False,False,False,False,False,False,0,0,False,False,100,31,True,0,False,0,False,0,12,0,False
2862,"Blason revigorant","Des PV sont récupérés périodiquement.",12935,0,0,180,1,16,0,False,False,False,False,False,False,False,False,False,0,0,False,False,100,0,True,0,False,0,False,0,0,0,False
2863,"Lémure","L'enveloppe corporelle est habitée par un avatar.",19308,0,5,180,1,16,0,False,False,False,False,False,False,False,False,False,0,0,False,False,0,27,True,0,False,0,False,0,0,0,False
2864,"Dosis eucrasique III","Les temps de lancement et de recharge des sorts et des techniques d'arme sont allongés.",12962,0,0,181,2,17,0,False,False,False,False,False,False,False,False,False,0,0,False,False,10,0,True,0,False,5,False,0,0,0,False
2865,"Diagnosis eucrasique","Insensible à un certain montant de dégâts.",12954,28,0,181,1,16,0,False,False,False,False,False,False,False,False,False,0,0,False,False,100,0,True,0,False,0,False,0,12,0,False
2866,"Prognosis eucrasique","Insensible à un certain montant de dégâts.",12954,28,0,181,1,16,0,False,False,False,False,False,False,False,False,False,0,0,False,False,100,0,True,0,False,0,False,0,12,0,False
2867,"Eukrasia","Certaines actions sont remplacées.",12953,0,0,181,1,16,0,False,False,False,False,False,False,False,True,True,0,0,False,False,0,0,True,0,False,0,False,0,0,0,False
2868,"Pneuma","Les dégâts reçus sont réduits.",12969,0,0,181,1,16,0,False,False,False,False,False,False,False,False,False,0,0,False,False,-10,0,True,0,False,0,False,0,0,0,False
2869,"Haima","Insensible à un certain montant de dégâts.",12958,0,0,181,1,16,0,False,False,False,False,False,False,False,False,False,0,0,False,False,100,0,True,0,False,0,False,0,12,0,False
2870,"Haimatinon","Quand la barrière de Haima a absorbé son montant de dégâts, Haimatinon en applique une nouvelle en échange d'un degré. Haimatinon restaure des PV en fonction des degrés restants lorsqu'il prend fin.",17585,0,5,181,1,16,0,False,False,False,False,False,False,False,False,False,0,0,False,False,100,27,True,0,False,0,False,0,0,0,False
2871,"Kardia","Des bonus sont octroyés à la cible bénéficiant de Kardion lorsque certains sorts offensifs sont lancés.",12951,0,0,181,1,16,0,False,False,False,False,False,False,False,True,True,0,0,False,False,0,0,True,0,False,0,False,0,0,0,False
2872,"Kardion","Bénéficie de bonus lorsque le joueur à l'origine de l'effet lance certains sorts offensifs.",12952,0,0,181,1,16,0,False,False,False,False,False,False,False,True,True,0,0,False,True,0,0,True,0,False,0,False,0,0,0,False
2873,"Transcendance","Transcende ses limites.",16308,0,0,1,1,16,0,False,False,False,False,False,False,False,False,False,0,0,False,False,0,0,True,0,False,0,False,0,0,0,False
2874,"Chaîne à retardement","Le corps est enserré par une chaîne magique imprégnée d'éther de Lumière et de feu.",15372,0,0,1,2,17,352,False,False,False,False,False,False,False,False,False,200,0,False,False,0,0,True,0,False,0,False,0,0,0,False
2875,"Chaîne à retardement","Le corps est enserré par une chaîne magique imprégnée d'éther de Lumière et de feu.",15372,0,0,1,2,17,352,False,False,False,False,False,False,False,False,False,200,0,False,False,0,0,True,0,False,0,False,0,0,0,False
2876,"Cape de héros","L'épée de héros est équipée.",15633,89,0,1,1,16,0,False,False,False,False,False,False,False,True,True,200,0,False,False,0,0,False,0,False,0,False,0,0,0,False
2877,"Cape de mage","Le bâton de mage est équipé.",15634,89,0,1,1,16,0,False,False,False,False,False,False,False,True,True,200,0,False,False,0,0,False,0,False,0,False,0,0,0,False
2878,"Cape de muse","Le chakram de muse est équipé.",15385,89,0,1,1,16,0,False,False,False,False,False,False,False,True,True,200,0,False,False,0,0,False,0,False,0,False,0,0,0,False
2879,"Volonté Adamas","La génération d'inimitié est augmentée.",12506,0,0,1,1,16,0,False,False,False,False,False,False,False,True,True,0,0,False,False,200,0,False,0,False,0,False,0,0,0,False
2880,"毒","毒に冒された状態。ＨＰが徐々に失われる。",17001,54,8,1,2,1,0,False,False,False,False,False,False,False,True,True,0,0,False,False,10,0,False,0,False,5,False,0,0,0,False
2881,"","",0,0,0,1,1,0,0,False,False,False,False,False,False,False,True,True,0,0,True,False,20,0,True,0,False,0,False,0,0,0,False
2882,"被物理ダメージ増加","受ける物理ダメージが増加する状態。",15053,36,0,1,2,17,0,False,False,False,False,False,False,False,True,True,0,0,False,False,10,0,False,0,False,0,False,0,0,0,False
2883,"スロウ","オートアタックの攻撃間隔と、ウェポンスキルおよび魔法のキャストタイムとリキャストタイムが延長された状態。",15009,5,0,1,2,13,0,False,False,False,False,False,False,False,True,True,0,0,False,False,15,0,False,0,False,0,False,0,0,0,False
2884,"ＨＰ自然回復無効","ＨＰ自然回復が無効化された状態。",16825,0,0,1,2,17,0,False,False,False,False,False,False,False,True,True,0,0,False,False,0,14,False,0,False,0,False,0,0,0,False
2885,"Malédiction contigüe","Les personnes proches sont peu à peu enserrées par une chaîne magique.",15375,0,0,1,2,17,0,False,False,False,False,False,False,False,False,False,200,0,False,False,0,0,True,0,False,0,False,0,0,0,False
2886,"Malédiction contigüe","Les personnes proches sont peu à peu enserrées par une chaîne magique.",15375,0,0,1,2,17,0,False,False,False,False,False,False,False,False,False,200,0,False,False,0,0,True,0,False,0,False,0,0,0,False
2887,"Malédiction contigüe","Les personnes proches sont peu à peu enserrées par une chaîne magique.",15375,0,0,1,2,17,0,False,False,False,False,False,False,False,False,False,200,0,False,False,0,0,True,0,False,0,False,0,0,0,False
2888,"Malédiction lointaine","Les personnes éloignées sont peu à peu enserrées par une chaîne magique.",15377,0,0,1,2,17,0,False,False,False,False,False,False,False,False,False,200,0,False,False,0,0,True,0,False,0,False,0,0,0,False
2889,"Malédiction lointaine","Les personnes éloignées sont peu à peu enserrées par une chaîne magique.",15377,0,0,1,2,17,0,False,False,False,False,False,False,False,False,False,200,0,False,False,0,0,True,0,False,0,False,0,0,0,False
2890,"Malédiction lointaine","Les personnes éloignées sont peu à peu enserrées par une chaîne magique.",15377,0,0,1,2,17,0,False,False,False,False,False,False,False,False,False,200,0,False,False,0,0,True,0,False,0,False,0,0,0,False
2891,"Instinct du harponneur","La présence d'une créature aquatique rare, n'apparaissant que dans des conditions par<SoftHyphen/>ti<SoftHyphen/>cu<SoftHyphen/>liè<SoftHyphen/>res, a été détectée, rendant sa capture par harponnage possible.",11101,0,0,1,1,16,0,False,False,False,False,False,False,False,False,False,0,0,False,False,0,0,True,0,False,0,False,0,0,0,False
2892,"","",0,89,0,1,2,0,0,True,False,True,True,False,False,False,False,True,0,0,True,False,0,4,True,0,False,0,False,0,30,0,False
2893,"Putréfaction","L'état avancé de la maladie a provoqué une transformation du corps.",15014,0,0,1,2,0,0,False,False,False,False,False,False,False,True,True,200,0,False,False,0,0,True,0,False,0,False,0,0,0,False
2894,"","",0,0,0,1,1,0,0,True,False,True,True,False,False,False,False,True,0,0,True,False,0,4,True,0,False,0,False,0,0,0,False
2895,"Serment de paix","Hraesvelgr a promis à Shiva de ne plus tuer d'humains.",15456,0,0,1,1,16,0,False,False,False,False,False,False,False,True,True,200,0,False,False,0,0,True,0,False,0,False,0,0,0,False
2896,"Vœu d'ané<SoftHyphen/>an<SoftHyphen/>tis<SoftHyphen/>se<SoftHyphen/>ment","Cible de la haine de Nidhogg ayant pour cause la perte de Ratatosk. La puissance des effets curatifs prodigués est réduite, et des dégâts périodiques sont subis. Lorsque l'effet prend fin, une douleur atroce est infligée aux alentours.",15457,0,0,1,2,17,0,False,False,False,False,False,False,False,False,False,207,0,False,False,10,30,False,0,False,5,False,0,0,0,False
2897,"Vœu d'ané<SoftHyphen/>an<SoftHyphen/>tis<SoftHyphen/>se<SoftHyphen/>ment rompu","La cible est libérée du vœu d'ané<SoftHyphen/>an<SoftHyphen/>tis<SoftHyphen/>se<SoftHyphen/>ment de Nidhogg.",15458,0,0,1,2,17,59,False,False,False,False,False,False,False,False,False,207,0,False,False,0,0,False,0,False,0,False,0,0,0,False
2898,"Chaleur graduelle","Le corps chauffe petit à petit. Lorsque l'effet prend fin, la victime subit Chaleur.",15459,0,0,1,2,17,0,False,False,False,False,False,False,False,False,False,205,0,False,False,0,0,True,0,False,0,False,0,0,0,False
2899,"Congélation graduelle","Le corps gèle petit à petit. Lorsque l'effet prend fin, la victime subit Congélation.",15238,0,0,1,2,17,0,False,False,False,False,False,False,False,False,False,205,0,False,False,0,0,True,0,False,0,False,0,0,0,False
2900,"Dégâts continus<Indent/>: Ténèbres","Des dégâts périodiques de Ténèbres sont subis.",15460,0,0,1,2,17,0,False,False,False,False,False,False,False,False,False,203,0,False,True,10,0,False,0,False,5,False,0,0,0,False
2901,"Dégâts continus<Indent/>: Lumière","Des dégâts périodiques de Lumière sont subis.",15461,0,0,1,2,17,0,False,False,False,False,False,False,False,False,False,203,0,False,True,10,0,False,0,False,5,False,0,0,0,False
2902,"Résistance au feu réduite+","La résistance à l'élément feu est considérablement réduite.",15595,0,0,1,2,17,0,False,False,False,False,False,False,False,False,False,150,0,False,False,-12,0,False,0,False,0,False,0,0,0,False
2903,"Résistance à la glace réduite+","La résistance à l'élément glace est considérablement réduite.",15596,0,0,1,2,17,0,False,False,False,False,False,False,False,False,False,145,0,False,False,-12,0,False,0,False,0,False,0,0,0,False
2904,"Chronique élégiaque","Écrit la chronique d'un événement futur.",15382,0,0,1,1,16,0,False,False,False,False,False,False,False,True,True,200,0,False,False,0,0,False,0,False,0,False,0,0,0,False
2905,"Renversant","Se bat à l'envers. Les aires d'attaque sont inversées.",15422,0,0,1,1,16,0,False,False,False,False,False,False,False,True,False,200,0,False,False,0,0,True,0,False,0,False,0,0,0,False
2906,"●偽神獣の猛毒","●グレイプニルの攻撃によって付与された毒。特定の攻撃を受ける度に毒が進化し、様々な弱体効果へと変化する。",15841,0,0,1,2,17,35,False,False,False,False,False,False,False,True,True,0,0,False,False,0,0,False,0,False,0,False,0,0,0,False
2907,"Mur enchanté de Tizona","Crée une aura bénéfique derrière le personnage, qui réduit les dégâts reçus.",12512,0,0,1,1,16,0,False,False,False,False,False,False,False,False,True,0,0,False,False,-10,0,False,0,False,0,False,0,0,0,False
2908,"Mur enchanté de Tizona","Les dégâts reçus sont réduits.",12513,0,0,1,1,16,0,False,False,False,False,False,False,False,False,True,0,0,False,False,-10,0,False,0,False,0,False,0,0,0,False
2909,"Déluge de Ténèbres","Le corps est affaibli par une attaque et les dégâts reçus sont augmentés.",15407,0,0,1,2,17,0,False,False,False,False,False,False,False,False,False,200,0,False,False,0,0,False,0,False,0,False,0,0,0,False
2910,"Au tapis","Impossible d'utiliser des actions ou de se déplacer.",15044,0,0,1,2,3,122,True,False,True,False,False,False,False,True,False,100,0,False,False,0,4,False,0,False,0,False,0,0,0,False
2911,"Malus de dégâts","Les dégâts infligés sont réduits.",15520,0,0,1,2,17,0,False,False,False,False,False,False,False,False,False,100,0,False,False,-10,0,False,0,False,0,False,0,0,0,False
2912,"Vulnérabilité augmentée","Les dégâts reçus sont augmentés.",17101,40,8,1,2,17,0,False,False,False,False,False,False,False,False,False,100,0,False,False,10,0,False,0,False,0,False,0,0,0,False
2913,"Blessure physique","Une blessure infligée par une arme tranchante saigne, et des dégâts périodiques sont subis.",15521,0,0,1,2,17,0,False,False,False,False,False,False,False,True,True,100,0,False,False,10,0,False,0,False,1,False,0,0,0,False
2914,"Perforation","Une blessure infligée par une arme perforante saigne, et des dégâts périodiques sont subis.",15522,0,0,1,2,17,0,False,False,False,False,False,False,False,True,True,100,0,False,False,10,0,False,0,False,2,False,0,0,0,False
2915,"Concussion","Une blessure infligée par une arme contondante saigne, et des dégâts périodiques sont subis.",15523,0,0,1,2,17,0,False,False,False,False,False,False,False,True,True,100,0,False,False,10,0,False,0,False,3,False,0,0,0,False
2916,"Brûlure","Des dégâts périodiques de feu sont subis.",15524,0,0,1,2,17,0,False,False,False,False,False,False,False,True,True,100,0,False,False,10,0,False,0,False,5,False,0,0,0,False
2917,"Gelure","Des dégâts périodiques de glace sont subis.",15525,0,0,1,2,17,0,False,False,False,False,False,False,False,True,True,100,0,False,False,10,0,False,0,False,5,False,0,0,0,False
2918,"Brûlure du vent","Des dégâts périodiques de vent sont subis.",15526,0,0,1,2,17,0,False,False,False,False,False,False,False,True,True,100,0,False,False,10,0,False,0,False,5,False,0,0,0,False
2919,"Emboué","Des dégâts périodiques de terre sont subis.",15527,0,0,1,2,17,0,False,False,False,False,False,False,False,True,True,100,0,False,False,10,0,False,0,False,5,False,0,0,0,False
2920,"Électrocution","Des dégâts périodiques de foudre sont subis.",15528,0,0,1,2,17,0,False,False,False,False,False,False,False,True,True,100,0,False,False,10,0,False,0,False,5,False,0,0,0,False
2921,"Œdème","Des dégâts périodiques d'eau sont subis.",15529,0,0,1,2,17,0,False,False,False,False,False,False,False,True,True,100,0,False,False,10,0,False,0,False,5,False,0,0,0,False
2922,"Saignement","Des dégâts périodiques neutres sont subis.",15530,0,0,1,2,17,0,False,False,False,False,False,False,False,True,True,100,0,False,False,10,0,False,0,False,5,False,0,0,0,False
2923,"Malédiction contigüe","Les personnes proches sont peu à peu enserrées par une chaîne magique.",15375,0,0,1,2,17,0,False,False,False,False,False,False,False,False,False,200,0,False,False,0,0,True,0,False,0,False,0,0,0,False
2924,"Malédiction lointaine","Les personnes éloignées sont peu à peu enserrées par une chaîne magique.",15377,0,0,1,2,17,0,False,False,False,False,False,False,False,False,False,200,0,False,False,0,0,True,0,False,0,False,0,0,0,False
2925,"Malédiction des attaquants","Les DPS sont maudits. Lorsque l'effet prend fin, les deux autres rôles subissent des dégâts considérables.
Recevoir certaines attaques permet d'annuler l'effet sans subir lesdits dégâts.",15434,0,0,1,2,17,0,False,False,False,False,False,False,False,False,False,200,0,False,False,0,0,False,0,False,0,False,0,0,0,False
2926,"Malédiction des guérisseurs","Les soigneurs sont maudits. Lorsque l'effet prend fin, les deux autres rôles subissent des dégâts considérables.
Recevoir certaines attaques permet d'annuler l'effet sans subir lesdits dégâts.",15435,0,0,1,2,17,0,False,False,False,False,False,False,False,False,False,200,0,False,False,0,0,False,0,False,0,False,0,0,0,False
2927,"Malédiction des protecteurs","Les tanks sont maudits. Lorsque l'effet prend fin, les deux autres rôles subissent des dégâts considérables.
Recevoir certaines attaques permet d'annuler l'effet sans subir lesdits dégâts.",15436,0,0,1,2,17,0,False,False,False,False,False,False,False,False,False,200,0,False,False,0,0,False,0,False,0,False,0,0,0,False
2928,"Flamme de la vie","Les dégâts infligés et la puissance de la magie curative sont augmentés.",15383,0,0,1,1,16,0,False,False,False,False,False,False,False,False,False,200,0,False,False,100,0,False,0,False,0,False,0,0,0,False
2929,"Flammèche de la vie","La puissance de la magie curative est augmentée.",15383,0,0,1,1,16,0,False,False,False,False,False,False,False,False,False,200,0,False,False,100,0,False,0,False,0,False,0,0,0,False
2930,"","",0,0,0,1,1,0,296,False,False,False,False,False,False,False,True,True,0,0,True,False,0,35,True,0,False,0,False,0,0,0,False
2931,"","",0,0,0,1,1,0,297,False,False,False,False,False,False,False,True,True,0,0,True,False,0,35,True,0,False,0,False,0,0,0,False
2932,"La grande forme","La durée de Sprint est augmentée dans les cités.",16520,0,0,1,1,16,0,False,False,False,False,False,False,False,True,True,0,1,False,False,0,0,True,0,True,0,False,0,0,0,False
2933,"Événement","Participe à un événement.",15765,0,0,1,1,0,344,False,False,True,True,False,False,False,True,True,100,0,False,False,0,0,True,0,False,0,False,0,0,0,False
2934,"●強制稼働","●未完成の状態だが強制的に短時間稼働している状態。効果時間中は破壊されない。",15910,0,0,1,1,16,0,False,False,False,False,False,False,False,True,True,0,0,False,False,0,0,False,0,False,0,False,0,0,0,False
2935,"Dégâts continus","Des dégâts périodiques neutres sont subis.",15067,0,0,1,2,17,0,False,False,False,False,False,False,False,False,False,100,0,False,False,10,0,False,0,False,5,False,0,0,0,False
2936,"Fulguration","Tout déplacement a lieu dans la direction vers laquelle pointe le curseur tournoyant au-dessus de la tête.",15809,0,0,1,2,17,43,False,False,False,False,False,False,False,False,False,100,0,False,False,0,0,False,0,False,0,False,0,0,0,False
2937,"Résistance au feu réduite+","La résistance à l'élément feu est considérablement réduite.",15595,0,0,1,2,17,0,False,False,False,False,False,False,False,False,False,200,0,False,False,-12,0,False,0,False,0,False,0,0,0,False
2938,"Kerakeia","Des PV sont récupérés périodiquement.",12970,0,0,181,1,16,0,False,False,False,False,False,False,False,False,False,5,0,False,True,10,0,False,0,False,0,False,0,0,0,False
2939,"Marquage","Fait l'objet du marquage d'un prédateur.",15026,0,0,1,2,17,0,False,False,False,False,False,False,False,False,False,200,0,False,False,0,0,False,0,False,0,False,0,0,0,False
2940,"Vulnérabilité physique augmentée","Les dégâts physiques reçus sont augmentés.",15053,36,0,1,2,17,0,False,False,False,False,False,False,False,False,False,50,0,False,False,10,0,False,0,False,0,False,0,0,0,False
2941,"Vulnérabilité magique augmentée","Les dégâts magiques reçus sont augmentés.",15057,38,0,1,2,17,0,False,False,False,False,False,False,False,False,False,50,0,False,False,10,0,False,0,False,0,False,0,0,0,False
2942,"Blessure physique","Une blessure infligée par une arme tranchante saigne, et des dégâts périodiques sont subis.",15521,0,0,1,2,17,0,False,False,False,False,False,False,False,False,False,100,0,False,False,10,0,False,0,False,1,False,0,0,0,False
2943,"Perforation","Une blessure infligée par une arme perforante saigne, et des dégâts périodiques sont subis.",15522,0,0,1,2,17,0,False,False,False,False,False,False,False,False,False,100,0,False,False,10,0,False,0,False,2,False,0,0,0,False
2944,"Concussion","Une blessure infligée par une arme contondante saigne, et des dégâts périodiques sont subis.",15523,0,0,1,2,17,0,False,False,False,False,False,False,False,False,False,100,0,False,False,10,0,False,0,False,3,False,0,0,0,False
2945,"Brûlure","Des dégâts périodiques de feu sont subis.",15524,0,0,1,2,17,0,False,False,False,False,False,False,False,False,False,100,0,False,False,10,0,False,0,False,5,False,0,0,0,False
2946,"Gelure","Des dégâts périodiques de glace sont subis.",15525,0,0,1,2,17,0,False,False,False,False,False,False,False,False,False,100,0,False,False,10,0,False,0,False,5,False,0,0,0,False
2947,"Brûlure du vent","Des dégâts périodiques de vent sont subis.",15526,0,0,1,2,17,0,False,False,False,False,False,False,False,False,False,100,0,False,False,10,0,False,0,False,5,False,0,0,0,False
2948,"Emboué","Des dégâts périodiques de terre sont subis.",15527,0,0,1,2,17,0,False,False,False,False,False,False,False,False,False,100,0,False,False,10,0,False,0,False,5,False,0,0,0,False
2949,"Électrocution","Des dégâts périodiques de foudre sont subis.",15528,0,0,1,2,17,0,False,False,False,False,False,False,False,False,False,100,0,False,False,10,0,False,0,False,5,False,0,0,0,False
2950,"Œdème","Des dégâts périodiques d'eau sont subis.",15529,0,0,1,2,17,0,False,False,False,False,False,False,False,False,False,100,0,False,False,10,0,False,0,False,5,False,0,0,0,False
2951,"Saignement","Des dégâts périodiques neutres sont subis.",15530,0,0,1,2,17,0,False,False,False,False,False,False,False,False,False,100,0,False,False,10,0,False,0,False,5,False,0,0,0,False
2952,"Final véritable","Les dégâts infligés sont augmentés.",13709,0,0,1,1,16,0,False,False,False,False,False,False,False,False,False,1,0,False,False,10,0,False,0,False,0,False,0,0,0,False
2953,"Étourdissement","Toute action est impossible.",15004,0,0,1,2,3,0,True,False,True,False,False,False,False,False,False,100,0,False,False,0,0,False,0,False,0,False,0,0,0,False
2954,"Volonté in<SoftHyphen/>é<SoftHyphen/>bran<SoftHyphen/>la<SoftHyphen/>ble","À l'exception d'une attaque par<SoftHyphen/>ti<SoftHyphen/>cu<SoftHyphen/>liè<SoftHyphen/>re, lorsque des dégâts rendant inconscient sont subis, cet effet est remplacé par Persévérance absolue.",17591,0,5,1,1,16,0,False,False,False,False,False,False,False,True,True,70,0,False,False,0,0,True,0,False,0,False,0,31,0,False
2955,"Persévérance absolue","À l'exception d'une attaque par<SoftHyphen/>ti<SoftHyphen/>cu<SoftHyphen/>liè<SoftHyphen/>re, aucun dégât n'est subi. Impossible d'utiliser des actions ou de se déplacer.",15411,40,0,1,2,3,0,True,False,True,False,False,False,False,False,False,100,0,False,False,0,4,True,0,False,0,False,0,31,0,False
2956,"精霊の加護","被ダメージを軽減するシールドを発生させている状態。",15021,0,0,1,1,16,0,False,False,False,False,False,False,False,True,True,0,0,False,False,0,4,False,0,False,0,False,0,27,0,False
2957,"Invisibilité rapide","Totalement invisible. La vitesse de déplacement est augmentée.",15404,0,0,1,1,16,0,False,False,False,False,False,False,False,False,False,100,0,False,False,0,0,True,0,False,0,False,0,0,0,False
2958,"Caprice de princesse<Indent/>: en avant","Un caprice force à se tourner vers l'avant.",15424,0,0,1,1,16,0,False,False,False,False,False,False,False,True,False,200,0,False,False,0,0,False,0,False,0,False,0,0,0,False
2959,"Ôgi<Indent/>: Namikiri préparée","Ôgi<Indent/>: Namikiri peut être lancée.",13313,0,0,111,1,16,0,False,False,False,False,False,False,False,False,False,0,2,False,False,0,0,False,0,False,0,False,0,0,0,False
2960,"Brasier amélioré","La puissance de Brasier est augmentée.",12659,0,0,26,1,16,0,False,False,False,False,False,False,False,True,True,0,2,False,False,0,0,False,0,False,0,False,0,0,0,False
2961,"Au tapis","Impossible d'utiliser des actions ou de se déplacer.",15044,89,0,1,2,3,0,True,False,True,False,False,False,False,True,False,100,0,False,False,0,4,False,0,False,0,False,0,0,0,False
2962,"Serpent sifflant au vent","Des dégâts périodiques de poison sont subis.",10352,0,0,1,2,1,0,False,False,False,False,False,False,True,False,False,10,0,False,True,10,0,False,0,False,2,False,0,0,0,False
2963,"Loup bondissant au vent","Des dégâts périodiques de vent sont subis.",10360,0,0,1,2,17,0,False,False,False,False,False,False,True,False,False,10,0,False,True,10,0,False,0,False,2,False,0,0,0,False
2964,"Final radieux","Les dégâts infligés sont augmentés.",12624,0,0,24,1,16,0,False,False,False,False,False,False,False,False,False,0,0,False,False,5,0,False,0,False,0,False,0,0,0,False
2965,"Toxine mortelle","Le corps a été infecté par une toxine mortelle. Rend inconscient lorsque la durée de l'effet s'est écoulée.",15388,0,0,1,2,17,357,False,False,False,False,False,False,True,False,False,200,0,False,False,0,0,False,0,False,0,False,0,0,0,False
2966,"Sentiment d'isolement","Une solitude extrême influe sur le mental. Provoque l'effet Hystérie à la fin de l'effet si aucun équipier n'est à proximité.",15428,67,0,1,2,17,0,False,False,False,False,False,False,False,False,False,200,0,False,False,538,0,False,0,False,0,False,0,0,0,False
2967,"Dégâts continus","Des dégâts périodiques neutres sont subis.",15067,0,0,1,2,17,0,False,False,False,False,False,False,False,False,False,100,0,False,False,10,0,False,0,False,6,False,0,0,0,False
2968,"Craniotomie","Les effets de la manipulation cérébrale influent sur le mental et poussent à attaquer les alliés. Le fonc<SoftHyphen/>tion<SoftHyphen/>ne<SoftHyphen/>ment du corps est perturbé et des dégâts périodiques sont subis.",15843,0,0,1,2,17,0,False,False,False,False,False,False,False,True,True,200,0,False,False,10,0,True,0,False,5,False,0,0,0,False
2969,"Sapience de sage","Les con<SoftHyphen/>nais<SoftHyphen/>san<SoftHyphen/>ces en noologie permettent au corps de résister aux effets de Craniotomie.",15897,0,0,1,1,16,0,False,False,False,False,False,False,False,True,False,200,0,False,False,0,0,True,0,False,0,False,0,0,0,False
2970,"","",0,0,0,1,1,0,0,False,False,False,False,False,False,False,False,True,0,0,True,False,0,28,True,0,False,0,False,0,0,0,False
2971,"PV maximums réduits","Les PV maximums sont réduits.",15076,6,0,1,2,17,0,False,False,False,False,False,False,True,False,False,50,0,False,False,-10,0,False,0,False,0,False,0,0,0,False
